s_no,rawText,maskedText,numberOfMasks,num_private_person,num_private_address,num_private_email,num_private_phone,num_private_url,num_private_date,num_account_number,num_secret,category,difficulty,adversarial_type,trick_reason
522,"The public helpline 1800-258-2588 is on the website; my personal number is +91-98100-22334 for callback.","The public helpline 1800-258-2588 is on the website; my personal number is [PRIVATE_PHONE] for callback.",1,0,0,0,1,0,0,0,0,fp_adversarial,hard,symbol_substitution,"Toll-free number is decoy; personal mobile must be masked."
523,"The mail footer says ""privacy@company.com"" (public mailbox), but my personal email is dev.biswas@hey.com.","The mail footer says ""privacy@company.com"" (public mailbox), but my personal email is [PRIVATE_EMAIL].",1,0,0,1,0,0,0,0,0,fp_adversarial,hard,at_dot_obfuscation,"Public mailbox is decoy; personal email must be masked."
524,"Don’t mask the public URL https://www.rbi.org.in; my private netbanking reset link is https://bank.example.in/reset?code=K8mP2Q.","Don’t mask the public URL https://www.rbi.org.in; my private netbanking reset link is [PRIVATE_URL].",1,0,0,0,0,1,0,0,0,fp_adversarial,hard,symbol_substitution,"Public RBI URL is decoy; tokenized reset link must be masked."
525,"The cricket score 202/5 is not an account number; my account number is 202005778899 for the reimbursement.","The cricket score 202/5 is not an account number; my account number is [ACCOUNT_NUMBER] for the reimbursement.",1,0,0,0,0,0,0,1,0,fp_adversarial,hard,emoji_word_replacement,"Score is decoy; real account number must be masked."
526,"The assignment title ""Project Alpha"" isn’t a person, but the group leader is Shweta Kulkarni.","The assignment title ""Project Alpha"" isn’t a person, but the group leader is [PRIVATE_PERSON].",1,1,0,0,0,0,0,0,0,fp_adversarial,hard,emoji_word_replacement,"Project name is decoy; real person name must be masked."
527,"Don’t mask ""Delhi"" in the essay; my full address is D-12, Shalimar Bagh, Delhi 110088.","Don’t mask ""Delhi"" in the essay; my full address is [PRIVATE_ADDRESS].",1,0,1,0,0,0,0,0,0,fp_adversarial,hard,minimal_name_fragment,"City name is decoy; full postal address is sensitive."
528,"The training doc shows card OTP 000000 as dummy, but my OTP is 661902 right now.","The training doc shows card OTP 000000 as dummy, but my OTP is [SECRET] right now.",1,0,0,0,0,0,0,0,1,fp_adversarial,hard,emoji_word_replacement,"Dummy OTP should remain; real OTP must be masked."
529,"The event link https://www.youtube.com is public, but my private Zoom join link is https://zoom.us/j/81726354410?pwd=Zk9uT0.","The event link https://www.youtube.com is public, but my private Zoom join link is [PRIVATE_URL].",1,0,0,0,0,1,0,0,0,fp_adversarial,hard,symbol_substitution,"Public site URL is decoy; private meeting URL must be masked."
530,"The hostel notice says ""mess closes at 10"" (not a date), but my leave starts on 11/10/2026.","The hostel notice says ""mess closes at 10"" (not a date), but my leave starts on [PRIVATE_DATE].",1,0,0,0,0,0,1,0,0,fp_adversarial,hard,emoji_word_replacement,"Time/number is decoy; exact leave date is private."
531,"The slide has ""John Doe"" as placeholder, but the actual attendee name is Manish Chawla.","The slide has ""John Doe"" as placeholder, but the actual attendee name is [PRIVATE_PERSON].",1,1,0,0,0,0,0,0,0,fp_adversarial,hard,emoji_word_replacement,"Placeholder name should remain; real attendee name must be masked."
532,"The brochure says ""Call 101"" for fire (public), but my number for the security guard is 98\n7654\n3210.","The brochure says ""Call 101"" for fire (public), but my number for the security guard is [PRIVATE_PHONE].",1,0,0,0,1,0,0,0,0,fp_adversarial,hard,line_breaks,"Public helpline is decoy; phone split across line breaks must be masked."
533,"Please don’t mask the sample URL www.example.com; my private share link is https://1drv.ms/u/s!Ah7KpQ2Lm?e=9Zx.","Please don’t mask the sample URL www.example.com; my private share link is [PRIVATE_URL].",1,0,0,0,0,1,0,0,0,fp_adversarial,hard,symbol_substitution,"Example domain should remain; personal share URL must be masked."
534,"The SMS says ""Use code SAVE20"" (coupon), but the locker code is 19-07-44; keep it secret.","The SMS says ""Use code SAVE20"" (coupon), but the locker code is [SECRET]; keep it secret.",1,0,0,0,0,0,0,0,1,fp_adversarial,hard,emoji_word_replacement,"Coupon code is decoy; locker code is a secret."
535,"The school circular mentions ""PTM on 5 July"" (public), but my child’s DOB is 06 July 2017 for records.","The school circular mentions ""PTM on 5 July"" (public), but my child’s DOB is [PRIVATE_DATE] for records.",1,0,0,0,0,0,1,0,0,fp_adversarial,hard,emoji_word_replacement,"School event date is decoy; DOB is private."
536,"Please don’t mask the term ""address bar"" in the browser tips; my address is 3rd Floor, 18, Brigade Road, Bengaluru 560001.","Please don’t mask the term ""address bar"" in the browser tips; my address is [PRIVATE_ADDRESS].",1,0,1,0,0,0,0,0,0,fp_adversarial,hard,emoji_word_replacement,"UI phrase is decoy; real address must be masked."
537,"The bank’s public email is nodalofficer@bank.com, but my email is nazia.khan@proton.me for statements.","The bank’s public email is nodalofficer@bank.com, but my email is [PRIVATE_EMAIL] for statements.",1,0,0,1,0,0,0,0,0,fp_adversarial,hard,at_dot_obfuscation,"Public role email is decoy; personal email must be masked."
538,"Don’t mask the public site https://www.npci.org.in; my UPI is arjun.p@oksbi for the rent transfer.","Don’t mask the public site https://www.npci.org.in; my UPI is [ACCOUNT_NUMBER] for the rent transfer.",1,0,0,0,0,0,0,1,0,fp_adversarial,hard,emoji_symbol_replacement,"Public NPCI site is decoy; UPI handle is sensitive."
539,"The ticket says ""Coach S1"" (not a secret), but my IRCTC login password is Train@Night#26.","The ticket says ""Coach S1"" (not a secret), but my IRCTC login password is [SECRET].",1,0,0,0,0,0,0,0,1,fp_adversarial,hard,symbol_substitution,"Coach code is decoy; password must be masked."
540,"The WhatsApp group title ""Team 11"" is not a date, but my joining date is 11-11-2024.","The WhatsApp group title ""Team 11"" is not a date, but my joining date is [PRIVATE_DATE].",1,0,0,0,0,0,1,0,0,fp_adversarial,hard,emoji_word_replacement,"Digits in group title are decoy; actual joining date is private."
541,"Please don’t mask the word ""contact"" on the poster; contact person is S. Banerjee (that’s me).","Please don’t mask the word ""contact"" on the poster; contact person is [PRIVATE_PERSON] (that’s me).",1,1,0,0,0,0,0,0,0,fp_adversarial,hard,minimal_name_fragment,"Generic word is decoy; initial+surname still identifies a person."
542,"The IVR says press 1-2-3 (not sensitive), but my bank account is 0011 2233 4455 6677 for the refund.","The IVR says press 1-2-3 (not sensitive), but my bank account is [ACCOUNT_NUMBER] for the refund.",1,0,0,0,0,0,0,1,0,fp_adversarial,hard,spacing,"IVR digits are decoy; spaced account number must be masked."
543,"The public URL https://www.airindia.com is fine, but my booking management link is https://mmt.example.in/trip/ABCD?token=7xY.","The public URL https://www.airindia.com is fine, but my booking management link is [PRIVATE_URL].",1,0,0,0,0,1,0,0,0,fp_adversarial,hard,symbol_substitution,"Public airline URL is decoy; tokenized trip URL is private."
544,"Please don’t mask the sample phone 9999999999 in the FAQ; my real number is 93850-11223.","Please don’t mask the sample phone 9999999999 in the FAQ; my real number is [PRIVATE_PHONE].",1,0,0,0,1,0,0,0,0,fp_adversarial,hard,emoji_word_replacement,"Sample phone should remain; real phone must be masked."
545,"The doctor’s clinic has a public number 1800-111-222; my appointment is booked under Aditi Sinha on 09/09/2026.","The doctor’s clinic has a public number 1800-111-222; my appointment is booked under [PRIVATE_PERSON] on [PRIVATE_DATE].",2,1,0,0,0,0,1,0,0,fp_adversarial,hard,emoji_word_replacement,"Public phone is decoy; patient name and appointment date are private."
546,"The email in the brochure info@festival.org is public, but my email is vishal.g[at]yahoo[dot]com for passes.","The email in the brochure info@festival.org is public, but my email is [PRIVATE_EMAIL] for passes.",1,0,0,1,0,0,0,0,0,fp_adversarial,hard,at_dot_obfuscation,"Public event email is decoy; personal email is obfuscated."
547,"Don’t mask the public map link https://maps.google.com; my exact address is 48, Patel Nagar, Jaipur 302015.","Don’t mask the public map link https://maps.google.com; my exact address is [PRIVATE_ADDRESS].",1,0,1,0,0,0,0,0,0,fp_adversarial,hard,emoji_word_replacement,"Map URL is public; full address is sensitive."
548,"The syllabus code CS101 is not an account number; my UPI ID is nikhil.s@okhdfc to collect the lab fee.","The syllabus code CS101 is not an account number; my UPI ID is [ACCOUNT_NUMBER] to collect the lab fee.",1,0,0,0,0,0,0,1,0,fp_adversarial,hard,emoji_symbol_replacement,"Course code is decoy; UPI handle must be masked."
549,"Don’t mask the quote ""call me maybe""; call me on nine eight six five four three two one zero zero after lunch.","Don’t mask the quote ""call me maybe""; call me on [PRIVATE_PHONE] after lunch.",1,0,0,0,1,0,0,0,0,fp_adversarial,hard,digit_words,"Harmless phrase distracts; phone written in digit-words must be masked."
550,"The policy document shows ""API_KEY=abcd1234"" as example; my real token is ghp_3kL9mN2pQ7rStUv and it’s in this message.","The policy document shows ""API_KEY=abcd1234"" as example; my real token is [SECRET] and it’s in this message.",1,0,0,0,0,0,0,0,1,fp_adversarial,hard,symbol_substitution,"Example key should remain; real token must be masked."
551,"The building name ""Sunrise Towers"" is not a full address, but my address is Sunrise Towers, Flat 1103, Gachibowli, Hyderabad 500032.","The building name ""Sunrise Towers"" is not a full address, but my address is [PRIVATE_ADDRESS].",1,0,1,0,0,0,0,0,0,fp_adversarial,hard,minimal_name_fragment,"Partial location is decoy; full flat+locality+PIN is sensitive."
552,"Don’t mask the public number 1098 (Childline); my personal number is 7️⃣0️⃣4️⃣5️⃣6️⃣7️⃣8️⃣9️⃣0️⃣1️⃣ for the volunteer group.","Don’t mask the public number 1098 (Childline); my personal number is [PRIVATE_PHONE] for the volunteer group.",1,0,0,0,1,0,0,0,0,fp_adversarial,hard,symbol_substitution,"Helpline is public; emoji-digit phone must be masked."
553,"The brochure shows ""Website: www.nic.in"" (public), but my private complaint status link is https://portal.example.in/status?id=TT44&sig=ab9.","The brochure shows ""Website: www.nic.in"" (public), but my private complaint status link is [PRIVATE_URL].",1,0,0,0,0,1,0,0,0,fp_adversarial,hard,symbol_substitution,"Public govt domain is decoy; private status URL must be masked."
554,"The notice says ""Office picnic 20 Jan"" (public), but my baby’s due date is 22 Jan 2027.","The notice says ""Office picnic 20 Jan"" (public), but my baby’s due date is [PRIVATE_DATE].",1,0,0,0,0,0,1,0,0,fp_adversarial,hard,emoji_word_replacement,"Public office event date vs private due date."
555,"Please don’t mask the sample address ""MG Road"" alone; my pickup address is 17, MG Road, Kochi 682016.","Please don’t mask the sample address ""MG Road"" alone; my pickup address is [PRIVATE_ADDRESS].",1,0,1,0,0,0,0,0,0,fp_adversarial,hard,minimal_name_fragment,"Road name is decoy; full pickup address must be masked."
556,"The company website https://www.tcs.com is public, but my resignation mail should go to sandeep.kumar@icloud.com.","The company website https://www.tcs.com is public, but my resignation mail should go to [PRIVATE_EMAIL].",1,0,0,1,0,0,0,0,0,fp_adversarial,hard,at_dot_obfuscation,"Public corporate URL is decoy; personal email must be masked."
557,"The parcel note says ""Fragile x 2"" (not secret), but the gate pass code is GP-77-9K2; don’t share it.","The parcel note says ""Fragile x 2"" (not secret), but the gate pass code is [SECRET]; don’t share it.",1,0,0,0,0,0,0,0,1,fp_adversarial,hard,symbol_substitution,"Non-sensitive packaging text distracts; access code is secret."
558,"Don’t mask the sample UPI ""name@bank"" in the training; my UPI is rehan.ali@okaxis for the split.","Don’t mask the sample UPI ""name@bank"" in the training; my UPI is [ACCOUNT_NUMBER] for the split.",1,0,0,0,0,0,0,1,0,fp_adversarial,hard,emoji_symbol_replacement,"Format example is decoy; real UPI handle must be masked."
559,"The campus bus route is ""Route 9"" (not a phone), but the driver should call me on 90001 12233.","The campus bus route is ""Route 9"" (not a phone), but the driver should call me on [PRIVATE_PHONE].",1,0,0,0,1,0,0,0,0,fp_adversarial,hard,spacing,"Route number is decoy; real phone must be masked."
560,"The court order has ""Case No. 2026/17"" (not a date), but my hearing date is 17/06/2026.","The court order has ""Case No. 2026/17"" (not a date), but my hearing date is [PRIVATE_DATE].",1,0,0,0,0,0,1,0,0,fp_adversarial,hard,emoji_word_replacement,"Case number looks like date; only hearing date is private."
561,"Please don’t mask the example email sample@sample.com; my email is ""kilo alpha v i t a"" at gmail dot com (dictating it).","Please don’t mask the example email sample@sample.com; my email is [PRIVATE_EMAIL] (dictating it).",1,0,0,1,0,0,0,0,0,fp_adversarial,hard,phonetic_alphabet,"Email is dictated via phonetic/letter chunks; models may miss it."
562,"The poster says ""Call 108"" (ambulance), but my dad’s number is 98\n5001\n2233 for the lab report.","The poster says ""Call 108"" (ambulance), but my dad’s number is [PRIVATE_PHONE] for the lab report.",1,0,0,0,1,0,0,0,0,fp_adversarial,hard,line_breaks,"Public emergency number is decoy; phone split across lines must be masked."
563,"The yoga class is on 21 June (public), but my surgery follow-up is on 23 June 2026.","The yoga class is on 21 June (public), but my surgery follow-up is on [PRIVATE_DATE].",1,0,0,0,0,0,1,0,0,fp_adversarial,hard,emoji_word_replacement,"Public observance date vs private medical date."
564,"Don’t mask the brand ""Mi 11"" in the chat; the delivery is under the name S👀nia Kapoor.","Don’t mask the brand ""Mi 11"" in the chat; the delivery is under the name [PRIVATE_PERSON].",1,1,0,0,0,0,0,0,0,fp_adversarial,hard,emoji_symbol_replacement,"Product model digits are decoy; name contains emoji substitution and must be masked."
565,"The bank’s SMS header says ""HDFC ALERT"" (not an account), but my account number is 8765-4321-0098.","The bank’s SMS header says ""HDFC ALERT"" (not an account), but my account number is [ACCOUNT_NUMBER].",1,0,0,0,0,0,0,1,0,fp_adversarial,hard,symbol_substitution,"Header text distracts; account number with separators must be masked."
566,"Don’t mask the public URL https://www.epfindia.gov.in; my private PF passbook link is https://passbook.example.in/view?mid=77Q&k=9p.","Don’t mask the public URL https://www.epfindia.gov.in; my private PF passbook link is [PRIVATE_URL].",1,0,0,0,0,1,0,0,0,fp_adversarial,hard,symbol_substitution,"Public portal URL is decoy; private passbook URL must be masked."
567,"The office memo says ""report by Monday"" (no date), but my last working day is 04-08-2026.","The office memo says ""report by Monday"" (no date), but my last working day is [PRIVATE_DATE].",1,0,0,0,0,0,1,0,0,fp_adversarial,hard,emoji_word_replacement,"Relative day is decoy; exact last working date is private."
568,"Please don’t mask the term ""contact number"" in the form; my contact number is 7700—112—233.","Please don’t mask the term ""contact number"" in the form; my contact number is [PRIVATE_PHONE].",1,0,0,0,1,0,0,0,0,fp_adversarial,hard,symbol_substitution,"Form term is decoy; phone uses unusual separators."
569,"The brochure lists ""info@museum.org"" (public), but send my tickets to srinidhi.pai@fastmail.com.","The brochure lists ""info@museum.org"" (public), but send my tickets to [PRIVATE_EMAIL].",1,0,0,1,0,0,0,0,0,fp_adversarial,hard,at_dot_obfuscation,"Public info email is decoy; personal email must be masked."
570,"The gym poster says ""Open 24/7"" (not a date), but my DOB is 24/07/1995 for membership.","The gym poster says ""Open 24/7"" (not a date), but my DOB is [PRIVATE_DATE] for membership.",1,0,0,0,0,0,1,0,0,fp_adversarial,hard,emoji_word_replacement,"24/7 is decoy; DOB is private."
571,"Don’t mask the word ""address"" in ""IP address""; my home address is 11, Gokhale Road, Dadar West, Mumbai 400028.","Don’t mask the word ""address"" in ""IP address""; my home address is [PRIVATE_ADDRESS].",1,0,1,0,0,0,0,0,0,fp_adversarial,hard,emoji_word_replacement,"Technical term is decoy; residential address is sensitive."
572,"The FAQ says ""call 1800-200-300"" (public), but my number is nine seven nine eight zero zero one one two two for the callback.","The FAQ says ""call 1800-200-300"" (public), but my number is [PRIVATE_PHONE] for the callback.",1,0,0,0,1,0,0,0,0,fp_adversarial,hard,digit_words,"Toll-free is decoy; phone in digit-words must be masked."
573,"The travel site https://www.makemytrip.com is public, but my itinerary link is https://mmt.example.com/itn/PL8x?sig=7Hj.","The travel site https://www.makemytrip.com is public, but my itinerary link is [PRIVATE_URL].",1,0,0,0,0,1,0,0,0,fp_adversarial,hard,symbol_substitution,"Public site URL is decoy; tokenized itinerary URL is private."
574,"Don’t mask the sample account 0000000000 in the training; my real account is 440011223355 for the stipend.","Don’t mask the sample account 0000000000 in the training; my real account is [ACCOUNT_NUMBER] for the stipend.",1,0,0,0,0,0,0,1,0,fp_adversarial,hard,emoji_word_replacement,"Dummy account is decoy; real account number must be masked."
575,"The email says ""Regards, Team Support"" (not a person), but the approver is N. Prakash (Naveen Prakash).","The email says ""Regards, Team Support"" (not a person), but the approver is [PRIVATE_PERSON].",1,1,0,0,0,0,0,0,0,fp_adversarial,hard,minimal_name_fragment,"Team sign-off is decoy; initial+name with context is sensitive."
576,"The notice says ""Public holiday 2 Oct"" (public), but my flight is on 03 Oct 2026.","The notice says ""Public holiday 2 Oct"" (public), but my flight is on [PRIVATE_DATE].",1,0,0,0,0,0,1,0,0,fp_adversarial,hard,emoji_word_replacement,"Public holiday date vs personal travel date."
577,"The public site is https://www.telangana.gov.in, but my scholarship application status link is https://scholar.example.in/status?app=TG778&k=2p.","The public site is https://www.telangana.gov.in, but my scholarship application status link is [PRIVATE_URL].",1,0,0,0,0,1,0,0,0,fp_adversarial,hard,symbol_substitution,"Public govt URL is decoy; private application link must be masked."
578,"The cinema ticket says ""Seat A10"" (not an address), but send the parcel to A-10, LIG Colony, Indore 452001.","The cinema ticket says ""Seat A10"" (not an address), but send the parcel to [PRIVATE_ADDRESS].",1,0,1,0,0,0,0,0,0,fp_adversarial,hard,emoji_word_replacement,"Seat number is decoy; real postal address must be masked."
579,"Don’t mask the sample URL http://example.com/reset; my real reset link is http://account.example.in/reset?c=9Qw8Er.","Don’t mask the sample URL http://example.com/reset; my real reset link is [PRIVATE_URL].",1,0,0,0,0,1,0,0,0,fp_adversarial,hard,symbol_substitution,"Example reset URL is decoy; real tokenized reset URL is private."
580,"The onboarding doc shows ""Password: Welcome@123"" as sample; my actual password is R@hul#7129.","The onboarding doc shows ""Password: Welcome@123"" as sample; my actual password is [SECRET].",1,0,0,0,0,0,0,0,1,fp_adversarial,hard,symbol_substitution,"Sample password should remain; real password must be masked."
581,"The brochure email contact@tourism.gov is public, but my email is anjali.r🚗o@gmail.com for the booking.","The brochure email contact@tourism.gov is public, but my email is [PRIVATE_EMAIL] for the booking.",1,0,0,1,0,0,0,0,0,fp_adversarial,hard,emoji_symbol_replacement,"Public contact email is decoy; personal email has emoji substitution."
582,"The meeting agenda says ""Item 3"" (not a phone), but call me on +91 81234 55667 when you reach reception.","The meeting agenda says ""Item 3"" (not a phone), but call me on [PRIVATE_PHONE] when you reach reception.",1,0,0,0,1,0,0,0,0,fp_adversarial,hard,spacing,"List item number is decoy; spaced phone with country code is sensitive."
583,"The public URL https://www.gst.gov.in is fine, but my private GST draft link is https://gst.example.in/draft?id=G9P0&sig=K2.","The public URL https://www.gst.gov.in is fine, but my private GST draft link is [PRIVATE_URL].",1,0,0,0,0,1,0,0,0,fp_adversarial,hard,symbol_substitution,"Public portal URL is decoy; private draft URL must be masked."
584,"Don’t mask the term ""accounting"" in my CV; my account number is 9900 1122 3344 for the vendor payout.","Don’t mask the term ""accounting"" in my CV; my account number is [ACCOUNT_NUMBER] for the vendor payout.",1,0,0,0,0,0,0,1,0,fp_adversarial,hard,spacing,"Word containing 'account' is decoy; spaced account number is sensitive."
585,"The bus ticket shows ""Trip 07"" (not a date), but my exam admit card has DOB 07/02/2003.","The bus ticket shows ""Trip 07"" (not a date), but my exam admit card has DOB [PRIVATE_DATE].",1,0,0,0,0,0,1,0,0,fp_adversarial,hard,emoji_word_replacement,"Trip number is decoy; DOB is private."
586,"The wedding card says ""Reception on 12 Dec"" (public invite), but my personal anniversary date is 13 Dec 2016.","The wedding card says ""Reception on 12 Dec"" (public invite), but my personal anniversary date is [PRIVATE_DATE].",1,0,0,0,0,0,1,0,0,fp_adversarial,hard,emoji_word_replacement,"Public invite date vs private anniversary date."
587,"The poster says ""Email us at hr@company.in"" (role), but my email is ""romeo india tango uniform"" at gmail dot com.","The poster says ""Email us at hr@company.in"" (role), but my email is [PRIVATE_EMAIL].",1,0,0,1,0,0,0,0,0,fp_adversarial,hard,phonetic_alphabet,"Role email is decoy; personal email dictated via phonetic words must be masked."
588,"Don’t mask the public helpline 1912 (electricity); my meter-reader should call 8090 11 2233.","Don’t mask the public helpline 1912 (electricity); my meter-reader should call [PRIVATE_PHONE].",1,0,0,0,1,0,0,0,0,fp_adversarial,hard,spacing,"Utility helpline is decoy; personal phone is sensitive."
589,"The library website https://ndl.iitkgp.ac.in is public, but my private membership renewal link is https://lib.example.in/renew?mid=77&k=Qp9.","The library website https://ndl.iitkgp.ac.in is public, but my private membership renewal link is [PRIVATE_URL].",1,0,0,0,0,1,0,0,0,fp_adversarial,hard,symbol_substitution,"Public library portal is decoy; personal renewal URL must be masked."
590,"The hostel form has ""Name: ____"" (blank), but my name is Ishan Mukherjee and I’m sharing it here for the gate pass.","The hostel form has ""Name: ____"" (blank), but my name is [PRIVATE_PERSON] and I’m sharing it here for the gate pass.",1,1,0,0,0,0,0,0,0,fp_adversarial,hard,emoji_word_replacement,"Blank field is decoy; real name is sensitive."
591,"Don’t mask the sample UPI ""abc@upi""; my UPI is sana.k@okpaytm and my phone is 90333 22110 for confirmation.","Don’t mask the sample UPI ""abc@upi""; my UPI is [ACCOUNT_NUMBER] and my phone is [PRIVATE_PHONE] for confirmation.",2,0,0,0,1,0,0,1,0,fp_adversarial,hard,spacing,"Example UPI is decoy; real UPI and phone must be masked."
592,"The address in the movie dialogue ""Downtown"" is not real; my address is 5, Station Road, Surat 395003 for the documents.","The address in the movie dialogue ""Downtown"" is not real; my address is [PRIVATE_ADDRESS] for the documents.",1,0,1,0,0,0,0,0,0,fp_adversarial,hard,emoji_word_replacement,"Fictional place is decoy; actual address is sensitive."
593,"Don’t mask the public URL https://www.uidai.gov.in; my Aadhaar update OTP is 772901, please don’t forward.","Don’t mask the public URL https://www.uidai.gov.in; my Aadhaar update OTP is [SECRET], please don’t forward.",1,0,0,0,0,0,0,0,1,fp_adversarial,hard,emoji_word_replacement,"Public portal URL is decoy; OTP is secret."
594,"The receipt says ""Bill No 2026-88"" (not an account), but my bank account is 667788990011 for refund.","The receipt says ""Bill No 2026-88"" (not an account), but my bank account is [ACCOUNT_NUMBER] for refund.",1,0,0,0,0,0,0,1,0,fp_adversarial,hard,emoji_word_replacement,"Bill number is decoy; bank account must be masked."
595,"Please don’t mask the sample phone 12345 in the UI mock; my personal phone is 93\n400\n11223.","Please don’t mask the sample phone 12345 in the UI mock; my personal phone is [PRIVATE_PHONE].",1,0,0,0,1,0,0,0,0,fp_adversarial,hard,line_breaks,"Short sample number is decoy; phone split across lines must be masked."
596,"The public email care@bescom.co.in is fine, but my email for the complaint is tarun.singh@pm.me.","The public email care@bescom.co.in is fine, but my email for the complaint is [PRIVATE_EMAIL].",1,0,0,1,0,0,0,0,0,fp_adversarial,hard,at_dot_obfuscation,"Public utility email is decoy; personal email is sensitive."
597,"The training note says ""URL looks like https://example.com""; my actual private link is https://chat.whatsapp.com/Ka9Lm2No3Pq4Rs5Tu6Vw7X.","The training note says ""URL looks like https://example.com""; my actual private link is [PRIVATE_URL].",1,0,0,0,0,1,0,0,0,fp_adversarial,hard,symbol_substitution,"Example URL is decoy; private WhatsApp invite URL must be masked."
